[
  {
    "id": "TERM-TODO",
    "title": "TODO 工单",
    "summary": "需要后续处理的待办类型工单。",
    "claim_status": "confirmed",
    "lifecycle_status": "active",
    "confidence": "E3",
    "source_snapshot": "SNAP-sample",
    "semantic_revision": 1,
    "created_at": "2026-08-14T00:00:00Z",
    "updated_at": "2026-08-14T00:00:00Z"
  }
]
