[
  {
    "id": "ENT-work-order",
    "title": "整改工单",
    "summary": "承载施工问题、责任信息和计划完成时间的待办任务。",
    "claim_status": "confirmed",
    "lifecycle_status": "active",
    "confidence": "E3",
    "source_snapshot": "SNAP-sample",
    "semantic_revision": 1,
    "created_at": "2026-08-14T00:00:00Z",
    "updated_at": "2026-08-14T00:00:00Z"
  }
]
