[
  {
    "id": "ACT-inspector",
    "title": "工地检查员",
    "summary": "发现施工问题并发起整改工单的现场角色。",
    "claim_status": "confirmed",
    "lifecycle_status": "active",
    "confidence": "E3",
    "source_snapshot": "SNAP-sample",
    "semantic_revision": 1,
    "created_at": "2026-08-14T00:00:00Z",
    "updated_at": "2026-08-14T00:00:00Z"
  }
]
